"level","created","updated","url","user","id","group","tags","quote","text","relay link","direct link"
"1","2023-03-15T01:22:51","2023-03-15T01:22:51","https://ecologicalrewritings.pubpub.org/pub/u9kqmgwj","Yaremonia","53pgNMLPEe28LMuiUhxmMQ","kJGZB9q2",,,"¡Excelente idea! Creo que entiendo por dónde vas. Voy a revisar el texto de Fisher para matizar este fragmento. Muchas gracias por leerme :) ","https://hyp.is/53pgNMLPEe28LMuiUhxmMQ","https://ecologicalrewritings.pubpub.org/pub/u9kqmgwj#annotations:53pgNMLPEe28LMuiUhxmMQ"
"0","2023-03-25T13:49:35","2023-03-25T14:31:09","https://ecologicalrewritings.pubpub.org/pub/q1i4m7ao","rrf","4LN6qssTEe2qb9u1mFXPaQ","kJGZB9q2",,"De la energía obtenida a partir de la vinculación y desestabilización de los átomos, así como los enredos de la coexistencia viral","Creo que habría que señalar que así como la desestabilización de los átomos es efecto de una obra humana que terminó en una catástrofe, la proliferación y circulación de virus anidados en espacios donde lo humano no llegaba, y ahora, gracias al extractivismo sí, guarda un paralelo. La explosión de Chernóbil y la explosión de espacios virósferos (y la consecuente zoonosis) tienen puntos en común que debieran explicitarse. Se puede revisar, al respecto, Contagio social: guerra de clases microbiológica en China, del colectivo Chuang, que revisa y suplementa el trabajo de Rob Wallace Grandes granjas, grandes gripes. También se puede considerar, de Andreas Malm, El murciélago y el capital. Por otra parte, sería importante recordar que el plástico hoy se hace de petroleo, aunque el primer plástico se hizo de una materia inorgánica, la celulosa, de donde viene el celuloide. El petroleo y la energía nuclear tienen su origen en esa pulsión por la movilidad de la que habla Marder, una pulsión que también terminó catalizando la pandemia, comomuestra muy bien el colectivo Chuang. Esto da cuenta de un enredo de tiempos profundos y manías humanas que podrían tenerse en cuenta. ","https://hyp.is/4LN6qssTEe2qb9u1mFXPaQ","https://ecologicalrewritings.pubpub.org/pub/q1i4m7ao#annotations:4LN6qssTEe2qb9u1mFXPaQ"
"0","2023-03-25T14:17:31","2023-03-25T14:18:08","https://ecologicalrewritings.pubpub.org/pub/q1i4m7ao","rrf","x5TtrMsXEe2GYqc5jcw_XQ","kJGZB9q2",,"a Construcción Del Marco Est(Ético)","sin mayúsculas ... toda la referencia tiene mayúsculas que revisar. Lo mismo otras que están más abajo.","https://hyp.is/x5TtrMsXEe2GYqc5jcw_XQ","https://ecologicalrewritings.pubpub.org/pub/q1i4m7ao#annotations:x5TtrMsXEe2GYqc5jcw_XQ"
"0","2023-03-25T14:17:04","2023-03-25T14:17:04","https://ecologicalrewritings.pubpub.org/pub/q1i4m7ao","rrf","t-MAxMsXEe2xeb_8Mnmzyg","kJGZB9q2",,"Ustedes Brillan En Lo Oscuro","debería ir sin tantas mayúsculas: Ustedes brillan en lo oscuro. ","https://hyp.is/t-MAxMsXEe2xeb_8Mnmzyg","https://ecologicalrewritings.pubpub.org/pub/q1i4m7ao#annotations:t-MAxMsXEe2xeb_8Mnmzyg"
"0","2023-03-25T14:11:25","2023-03-25T14:11:25","https://ecologicalrewritings.pubpub.org/pub/q1i4m7ao","rrf","7cG0_MsWEe2dZGM7ogMYbg","kJGZB9q2",,"pandemia","Por cierto, esta pandemia, como muestra Rob Wallace, es una antecedida por otras de menor escala. La película Contagio, de 2010, que contó con importantes figura de Hollywood, da cuenta que se trata de un acontecimiento que no debiera sorprender tanto. ","https://hyp.is/7cG0_MsWEe2dZGM7ogMYbg","https://ecologicalrewritings.pubpub.org/pub/q1i4m7ao#annotations:7cG0_MsWEe2dZGM7ogMYbg"
"0","2023-03-25T14:06:54","2023-03-25T14:06:54","https://ecologicalrewritings.pubpub.org/pub/q1i4m7ao","rrf","TDwgDssWEe20qMuvMtjEWg","kJGZB9q2",,"plásticos de un solo uso","la noción de ""desechabilidad"" es bien reciente, y da cuenta de ello. Al respecto, ver Gay Hawkins, “Plastics”. Imre Szeman, Jennifer Wenzel y Patricia Yaeger, eds. Fueling Culture: 101 Words for Energy and Environment. New York: Fordham University Press, 2017. 271-274. ","https://hyp.is/TDwgDssWEe20qMuvMtjEWg","https://ecologicalrewritings.pubpub.org/pub/q1i4m7ao#annotations:TDwgDssWEe20qMuvMtjEWg"
"0","2023-03-25T13:58:16","2023-03-25T13:58:16","https://ecologicalrewritings.pubpub.org/pub/q1i4m7ao","rrf","F4uVjssVEe2-oI_wm0owuQ","kJGZB9q2",,"quienes","en lugar de quienes, podría ir: que","https://hyp.is/F4uVjssVEe2-oI_wm0owuQ","https://ecologicalrewritings.pubpub.org/pub/q1i4m7ao#annotations:F4uVjssVEe2-oI_wm0owuQ"
"0","2023-03-25T13:55:45","2023-03-25T13:56:16","https://ecologicalrewritings.pubpub.org/pub/q1i4m7ao","rrf","vaUBwssUEe20pCuZiVOj0w","kJGZB9q2",,"los plásticos","sería importante reparar en que los plásticos, a diferencia de la radioactividad y los virus, que tienen un tiempo profundo, el plástico es de tiempo corto. Fue creado recién en la segunda mitad del siglo XIX, y, como bien se señala, su masificación se dio en la segunda mitad del siglo XX, pero su permanencia sobre la tierra tendrá una temporalidad muchísimo mayor. Se lo suele confundir con el elástico, pero químicamente son muy distintos. Al respecto, ver Plástico. Un idilio tóxico, de Susan Freikel. También Plastic Matter, de Heather Davis. ","https://hyp.is/vaUBwssUEe20pCuZiVOj0w","https://ecologicalrewritings.pubpub.org/pub/q1i4m7ao#annotations:vaUBwssUEe20pCuZiVOj0w"
"0","2023-03-25T13:40:41","2023-03-25T13:40:41","https://ecologicalrewritings.pubpub.org/pub/q1i4m7ao","rrf","oppV5ssSEe2yioO8pd03tQ","kJGZB9q2",,"escapan los","debe decir: no escapan a los efectos... falta una a","https://hyp.is/oppV5ssSEe2yioO8pd03tQ","https://ecologicalrewritings.pubpub.org/pub/q1i4m7ao#annotations:oppV5ssSEe2yioO8pd03tQ"
"0","2023-03-25T13:38:43","2023-03-25T13:38:43","https://ecologicalrewritings.pubpub.org/pub/q1i4m7ao","rrf","XDG0CssSEe2_QIPvOLbyiw","kJGZB9q2",,"las","quizá aquí debe ser: los ","https://hyp.is/XDG0CssSEe2_QIPvOLbyiw","https://ecologicalrewritings.pubpub.org/pub/q1i4m7ao#annotations:XDG0CssSEe2_QIPvOLbyiw"
"0","2023-03-25T13:36:38","2023-03-25T13:36:38","https://ecologicalrewritings.pubpub.org/pub/q1i4m7ao","rrf","EX1RsssSEe2LM1sonjOemA","kJGZB9q2",,"hablé","quitar tilde de hablé. ","https://hyp.is/EX1RsssSEe2LM1sonjOemA","https://ecologicalrewritings.pubpub.org/pub/q1i4m7ao#annotations:EX1RsssSEe2LM1sonjOemA"
"0","2023-03-24T23:10:13","2023-03-24T23:10:13","https://ecologicalrewritings.pubpub.org/pub/q1i4m7ao","rrf","CFF2qsqZEe2LiXeosgLx4g","kJGZB9q2",,"memoria","hay una relación interesante entre memoria humana y fotograma. Tanto los fotogtamas de Tondeur, como los recuerdos de Marder son trazos. Pensando en la lectura que Derrida hace de Freud y su interpretación del blog mágico, se puede establecer una relación muy interesante. ","https://hyp.is/CFF2qsqZEe2LiXeosgLx4g","https://ecologicalrewritings.pubpub.org/pub/q1i4m7ao#annotations:CFF2qsqZEe2LiXeosgLx4g"
"0","2023-03-23T12:02:03","2023-03-23T12:02:03","https://ecologicalrewritings.pubpub.org/pub/oz0qu0q6","simonxix","hjbmcslyEe2Xhsfl9YXKFA","kJGZB9q2",,"who do not often have the chance to express ourselves in the testimonial register","The ambiguous status that testimonial writing might have in liberal-humanist culture and the academy is, indeed, so important to note. I think a similar ambiguity might be highlighted as regards its relationship to crisis, historical events, duration and the everyday. It is telling that a lot of writing framing itself as ‘witnessing’ in some way occurs in relation to dramatic, epochal historical events: wars, revolutions, natural or man-made disasters (among which we might class an explosion, nuclear or otherwise). I am thinking of Carolyn Forché’s poetry and writing, and Dionne Brand’s unforgettable, self-reflexive rendition of her awkward but generic role as ‘poet’ in America’s invasion of Grenada in 1983 (Brand, 2011, pp. 156-169); Victor Serge; John Reed; the list is endless. Leigh Gilmore has done a lot of work on testimony, witness, life-writing and autobiography that delves into their gendered, racialised and classed undercurrents in ways that might show us how to look at the ‘slow violence’ (Robert N. Proctor) that has been inherent in the more extended – and hard to capture – historical ‘events’ (austerity, disinvestment in infrastructures, nuclear fall-out) that the global majority is living (indeed has long been living) through, and whose chronic qualities seem to ask for a different kind of expressivity and reflection of situatedness, e.g. recent accounts of ‘intimate histories’ (see e.g. Hannah Proctor, https://www.historicalmaterialism.org/articles/history-from-within, or Saidiya Hartman’s ‘fabulation’). Although I still refer to these through individual authorial names, referenced here on this page and with academic import and weight (meaning the hegemonies of Western academia that you so well describe), they still seem to me to exist in proximity to what you have been trying to do, in the present – including as regards the relationship of image to text – in ways that I find hopeful.","https://hyp.is/hjbmcslyEe2Xhsfl9YXKFA","https://ecologicalrewritings.pubpub.org/pub/oz0qu0q6#annotations:hjbmcslyEe2Xhsfl9YXKFA"
"0","2023-03-23T12:01:30","2023-03-23T12:01:30","https://ecologicalrewritings.pubpub.org/pub/oz0qu0q6","simonxix","cuBu_slyEe2Y6kuQdqJImg","kJGZB9q2",,"one must conclude that community is always in/with time, always unfinished,","And community is also always in/with space. In that respect, it seems so important to recognise how hard editors of ‘living books’ actually find it to encourage the reuse/appropriation/disappropriation offered up, and quite how much (material, socialised) time and care it takes to coax – and perform – this activity sensitively, on- and offline, with all the nuances you’ve described (and which run counter to the ‘social’ as the metricised communicating human being is now supposed to perform – and seek – it, and whose conditions of ‘communication’ Jodi Dean has done a lot to theorise). My PhD research on early Soviet life made me realise it is just really hard to conceive of the experience of true convulsive collectivity (a loss of individuality that I realise may be different, but that I hope might also be compared to the forms of subjectivation inherent in disappropriation?). And how creativity, let alone ‘authorship’, might be experienced within that. Do we (and I am thinking here especially of scholarly workers) come anything close to Walter Benjamin’s experience, from 1927, of how “Each thought, each day, each life lies here [in Moscow] as on a laboratory table. ... No organism, no organisation, can escape this process.” Sensations which are also documented in Richard Stites’ Revolutionary Dreams: Utopian Vision and Experimental Life in the Russian Revolution, Oxford: Oxford University Press, 1989; and similarly, in Kristin Ross’s works on the Paris commune (Ross, 2008, 2015). The Soviet concept of the ‘social condenser’ is fascinating in this respect in that it places architecture, and space/s, right in the centre of psychosocial subjectivation, as a potentially intensifying, opening or collectivising force in social movement and change (as some have commented, these might importantly be separated into ‘planned’ and ‘accidental’ social condensers, meaning those which are forward-looking and intentional, or retroactively recognised for their capacities). If, as Teju Cole so memorably described, we have achieved the sort of collective spectacular alienation wherein we can witness ‘death in the browser tab’ while sitting still in front of a computer and toggling between that and other media ‘content’ (The New York Times Magazine, 2015, and online: https://www.nytimes.com/2015/05/24/magazine/death-in-the-browser-tab.html), how are we to expand living books’ writerly ‘space’ such that the tabs which living books’ readers/writers painstakingly write into might truly act as social condensers, in line with the more fervent hopes and dreams of ‘radical’ open access? As we sit at those computers, writing, our bodies slumped in chairs and our eyes tired and glazed, should we, can we, seek an experience of elated social dissolution the likes of which I’ve in recent times only seen described by authors contemplating the psychological experience of riots (e.g. Hannah Black, 2022; Tobi Haslett, 2021; Adrian Wohlleben, 2021). It is a vain imagining, probably, but I can’t help but wonder how might try and think of these phenomena together, or at least as potentially related? To me it seems inevitably to point to the fact that we cannot conceive of digital materials outside of the spaces in which they are engaged with. I’ve found Mark Nowak’s Social Poetics (2020) and June Jordan’s Poetry for the People (1995) some of the more helpful sources to think this relationship through (though I realise there are countless others). It also seems telling that they are to a lesser or greater extent centred in interpretations of communal pedagogy.","https://hyp.is/cuBu_slyEe2Y6kuQdqJImg","https://ecologicalrewritings.pubpub.org/pub/oz0qu0q6#annotations:cuBu_slyEe2Y6kuQdqJImg"
"0","2023-03-23T12:00:56","2023-03-23T12:00:56","https://ecologicalrewritings.pubpub.org/pub/oz0qu0q6","simonxix","Xq2ngMlyEe2rgH8-OQtSjg","kJGZB9q2",,"we shared the sense of a critical need to rethink our own material contexts","I relate to this viscerally, having just submitted a practice-based doctorate whose central research output was a transcription of the American poet, Bernadette Mayer’s, work Midwinter Day (1982). I used the difference in our respective temporal-geographic situatedness – as well as the catalytic generosity of her writing (which has the unmistakable effect of enabling its readers to feel that they can write too) – to revisit the conceptions of love, dreaming and creativity that structure her poem, from a vantage point that was divergent (I wasn’t in a double-parent family shaped like hers; was writing in the context of ecological cataclysm, not homeostasis as she evoked it; and had stopped dreaming for what I speculated were reasons to do with ageing). It was so telling how much was hidden in her poem in terms of its mechanics of construction; things I could only have found out by becoming deeply enmeshed inside its architecture and digging around on the internet to find out how on earth she had produced what I perceived to be a textual ‘miracle’, impossible to emulate in the same period of 24 hours. I found out, for example, that while she had written the poem over one day, she had collated press cuttings for local stories in advance (Mayer describes the making of lists associated with this prep as the tools of the trade of the epic poet), and used a tape recorder to store scraps of her speaking voice over the day, often finding the peace to work and concentrate by hiding from her children in a wardrobe! (See e.g. https://www.kcrw.com/culture/shows/the-organist/give-everybody-everything-the-financial-life-of-bernadette-mayer). I know from the more group-based and collaborative projects I’ve been involved with how hard it is to do such a thing collectively, however, and appreciate very much in this paragraph how you break down the practical stages involved in achieving both authorial differentiation and some kind of group consensus on artistic and medial strategy – the detailed deliberative process and length of time it takes to achieve these (which would, it follows, also explain why they are so rare). I mention in my PhD the part that a choreographic note of Yvonne Rainer’s played in moving me to research these somewhat treacherous, disruptive/disrupted lands between collective and individual articulation, as she seemed to have attained an admirable state of conceptual resolution over the question of where one should end and the other begin (the clarity of her notes on this were shocking to me at the time). For the exhibition within which I saw this note, see also: Yilmaz Dziewior and Barbara Engelbach (eds.), Yvonne Rainer: Space, Body, Language (Bregenz: Kunsthaus Bregenz, 2012).","https://hyp.is/Xq2ngMlyEe2rgH8-OQtSjg","https://ecologicalrewritings.pubpub.org/pub/oz0qu0q6#annotations:Xq2ngMlyEe2rgH8-OQtSjg"
"0","2023-03-23T11:59:00","2023-03-23T11:59:00","https://ecologicalrewritings.pubpub.org/pub/oz0qu0q6","simonxix","GRL7-MlyEe2jJoO3PcMkqA","kJGZB9q2",,"Chernobyl"," Your Preface brings to mind discussions in 2019 around HBO’s historical drama, Chernobyl, around which there was a lot of confusion relating to the composite character of Ulana Khomyuk, played by Emily Watson. The creators’ decision to compact the courageous investigations of multiple scientists – among which women counted relatively highly in the post-WWII Soviet Union – into those of one, single, female character seemed fascinating at the time; an admission that mainstream pictorial conventions of collectivity refuse to progress – in fact, appear mostly to be moving in reverse. Of course, your group – and this Preface – has instead engaged the polyvocal ‘exploded consciousness’ of Alexievich, via Marder and Tondeur, which – as a representational optic, an authorial sensibility – might stand as an antonym to the Chernobyl’s directors’ artistic approach? In their case, a small counter-gesture was at the time achieved by the release of podcast episodes simultaneous to the television ones, in which all their decisions were discussed, and the historical detail extensively set out – including via historical television/film content around which conversations and comparisons occurred on social media. Given the central narrative ploy however, this seemed in every meaningful respect to occur ‘out of frame’. I mention this example because it presents an environment equally – if differently – hostile to collective, disappropriative activity as the global corporate university: commercial television ‘streamers’, which harness public curiosity about history, facticity, the archive, and global experiential truths, only to poison its potential. Because you have decided to sit at the juncture of image and textual production, I am curious to what degree you are influenced by phenomena in these larger domains? It seems for example to speak to your project that corporate cannibalisation of the past is rife on these platforms – on which some of the largest, most expensive commissions have either been historical dramas, or explicitly derived from historical or newly available digitised content (viz., most conspicuously, Peter Morgan’s The Crown, but also the true-crime genre that has acted as a key commercial engine, as well as countless ‘minor’ documentaries clearly built out from the IP and commissioning value of personal video-archives that were presumably spontaneously created by individuals in their free time, such as Kingdom of Us (2017), Lucy Cohen’s affecting documentary about mental health and ‘dysfunctional’ families, to name a random example). But more importantly, too, a process is in train within which the potentially multiple, contingent, processual and open-ended is locked down into mythicised narratives that are culturally encoded as factual: a variation in the historical-dramatic genre of what Mary Anne Doane’s The Emergence of Cinematic Time (Cambridge, Massachusetts: Harvard University Press, 2002) analyses more generally as modern cinema’s defining characteristic: imposing linearity and, thus, some form of narrative predetermination). I never understood critics’ unqualified enthusiasm about the Chernobyl programme, which seems in every way semiotically necrotic, but still often wonder exactly what kind of cultural object it was, especially in a context that many have described as ‘agnotological’ (i.e. where systematic, orchestrated forgetting fosters reactionary – read: white-supremacist and fascist – energies, as theorised by Robert N. Proctor and Londa Schiebinger in various contexts). To imagine that anything else could happen within such a format is probably wrong-headed, but there were moments where the public acts of deconstruction performed via side-by-side comparisons of television scenes with their original inspiration – historical footage – seemed to offer something generative; a collaborative re-writing of sorts. The ‘steal this footage’ feature attached to Steal This Film, a series of documentaries on piracy made in the early 2000s, seemed to offer something comparable (http://footage.stealthisfilm.com/browse); and at the furthest reaches of libidinized platform content, I would say something similar is even offered in post-episode chicanery and collective satirical ‘citation’ of programmes like Love Island, after broadcast, albeit again to hegemonic ends... Do you feel that the collective activity you engaged in together partakes in any way of these economies or can be fenced off; and in which case, how would you picture the fence (as some kind of amalgam or assemblage of social, technical, geographic structures)? You answer this question already vis a vis nationalist and individualising tendencies: I suppose as an artist I’m trying to be more figurative and find some kind of picture? The artist Kandis Williams speaks persuasively of the battleground that archives and citation will become in our hybrid public realm and is worth quoting at length on this question (that is, if we accept that open-access, ‘living books’ and their contents are de facto archival): “I see the resurgence of the archives in the coming years being played out via media wars instigating a technocratic overhaul of all major forms of colonial infrastructure. The forward-facing interest in archives is a public response to the burden of dis-identifying with commonly held and widely resurgent white supremacist idealization and degradations. Colonial-genocidal interest in the other is a long-held source of many acts of violence, seeded in many fields. Understanding how deeply historical and mainstream narratives have slighted and dispossessed so many I think will cause more and more outcry and public pain. Pain that cannot and is bound to be recuperated by the practice of citation and of personal and collective archiving. This pain has for so long been destructive to communities that are simultaneously being eradicated and their cultures shuffled and filed in anecdotal or reliquary footnotes. There are so few understandable and reliable protocols to archive the unseen (that pain) that a kind of categorization and experiential crisis will emerge as both political mandates to divest from the virtual altogether and heightened stakes of digitization. With much of the power to record for permanence and monetization still being held by entertainment, commercial and institutional sectors, I think our stories will suffer the same turn of phrase [sic] at a faster pace of much media of people who’ve moved from marginal to the mainstream before us” (@kandis_williams, Instagram story featuring magazine article, reposted from @agnesesacchini, March, 2022).","https://hyp.is/GRL7-MlyEe2jJoO3PcMkqA","https://ecologicalrewritings.pubpub.org/pub/oz0qu0q6#annotations:GRL7-MlyEe2jJoO3PcMkqA"
"0","2023-03-14T12:03:33","2023-03-14T12:03:33","https://ecologicalrewritings.pubpub.org/pub/oz0qu0q6","garyhall","PmtzRMJgEe2QCJtA5iXQRQ","kJGZB9q2",,,"If you haven’t already, would it be an idea to say something about the current war in Ukraine and its links to Chernobyl? Just to acknowledge it in some way, if nothing else.","https://hyp.is/PmtzRMJgEe2QCJtA5iXQRQ","https://ecologicalrewritings.pubpub.org/pub/oz0qu0q6#annotations:PmtzRMJgEe2QCJtA5iXQRQ"
"0","2023-03-14T11:39:10","2023-03-14T11:54:34","https://ecologicalrewritings.pubpub.org/pub/oz0qu0q6","garyhall","1l9naMJcEe2czbMvyV-iGg","kJGZB9q2",,,"I really like that you focused on weeds, which are a little neglected perhaps. If not plants or fungi, most people operating in this kind of territory seem to look at trees. In the experimental publishing sphere, there's: Anaïs Berck. 2023a. ‘About an Algoliterary Publishing House’. Algoliterary Publishing (website), accessed March 10, https://algoliterarypublishing.net/pages/about.html Anaïs Berck, 2023b. ‘Paseo por arboles de madrid’. Algoliterary Publishing (website), accessed March 10, https://algoliterarypublishing.net/paseo-por-arboles-de-madrid.html But even in the mainstream it's trees. One of the central protagonists of Richard Power’s novel Overstory is a chestnut tree, for example, while theatre director Katie Mitchell has created a version of Anton Chekhov’s The Cherry Orchard from the perspective of the trees.","https://hyp.is/1l9naMJcEe2czbMvyV-iGg","https://ecologicalrewritings.pubpub.org/pub/oz0qu0q6#annotations:1l9naMJcEe2czbMvyV-iGg"
"0","2023-03-14T11:27:19","2023-03-14T11:27:19","https://ecologicalrewritings.pubpub.org/pub/oz0qu0q6","garyhall","LmXrlsJbEe2P_at4oCEYyw","kJGZB9q2",,"I noted in an essay","If you haven't already, might it be an idea to provide a reference and link to this essay?","https://hyp.is/LmXrlsJbEe2P_at4oCEYyw","https://ecologicalrewritings.pubpub.org/pub/oz0qu0q6#annotations:LmXrlsJbEe2P_at4oCEYyw"
